Đánh giá sản phẩm,Cảm xúc
"Sản phẩm tuyệt vời, chất lượng vượt ngoài mong đợi!",
Giao hàng chậm trễ và sản phẩm bị hỏng khi nhận được.,Tiêu cực
"Thiết kế đẹp mắt, màu sắc rất ưng ý, tôi sẽ mua lại lần nữa.",Tích cực
"Chất lượng quá kém, không đáng với số tiền bỏ ra.",Tiêu cực
"Dịch vụ khách hàng rất nhiệt tình, tôi rất hài lòng.",Tích cực
"Sản phẩm không giống mô tả, tôi rất thất vọng.",Tiêu cực
"Mua được giá khuyến mãi, rất hài lòng với chất lượng sản phẩm.",Tích cực
"Sản phẩm bị lỗi ngay khi mở hộp, hoàn toàn không sử dụng được.",Tiêu cực
"Giao hàng nhanh, chất lượng đúng như mô tả, tuyệt vời!",
"Tôi không hài lòng với dịch vụ và sản phẩm, quá tệ.",Tiêu cực
"Món hàng này thật sự đáng tiền, tôi sẽ giới thiệu cho bạn bè.",Tích cực
"Rất tệ, không đáng mua, sản phẩm hoàn toàn khác với hình ảnh.",Tiêu cực
,Tích cực
"Không thể sử dụng sau 1 lần dùng, chất lượng quá kém.",
"Chất lượng sản phẩm vượt mong đợi, rất ưng ý với giá tiền này.",Tích cực
"Giao hàng chậm và sản phẩm bị trầy xước, không hài lòng.",Tiêu cực
"Sản phẩm rất tốt, mình rất thích, dùng rất ổn định.",Tích cực
Tôi đã nhận hàng và sản phẩm không hoạt động như mô tả.,
"Hàng đẹp, chất lượng tốt và giá hợp lý.",
"Hàng không đúng như mong đợi, tôi không hài lòng.",Tiêu cực
"Tuyệt vời, mọi thứ đúng như mong đợi, rất đáng tiền.",Tích cực
,Tiêu cực
"Đóng gói cẩn thận, sản phẩm đúng mô tả, sẽ mua lại lần nữa.",
"Sản phẩm bị hư sau vài ngày sử dụng, rất thất vọng.",Tiêu cực
"Dịch vụ tốt, hàng nhận nhanh và đúng như quảng cáo.",Tích cực
"Chất lượng không như mong đợi, cảm giác bị lừa dối.",Tiêu cực
"Tôi rất hài lòng với sản phẩm, vượt xa mong đợi.",Tích cực
"Sản phẩm quá đắt so với chất lượng thực tế, không đáng tiền.",Tiêu cực
"Mọi thứ hoàn hảo, từ chất lượng đến dịch vụ khách hàng.",Tiêu cực
Hàng bị lỗi kỹ thuật và không được hỗ trợ bảo hành đúng cách.,Tích cực
"Chất lượng không tốt, sản phẩm nhìn rẻ tiền và không bền.",Tiêu cực
,Tích cực
"Sản phẩm nhận được khác xa với mô tả trên web, rất bực mình.",Tích cực
"Sản phẩm ổn, giá hợp lý, không có gì để phàn nàn.",Tiêu cực
"Dịch vụ chăm sóc khách hàng rất tệ, tôi sẽ không mua lại.",Tích cực
"Chất lượng vượt trội, tôi rất hài lòng.",Tiêu cực
"Mua về nhưng sản phẩm không hoạt động, rất bực mình.",Tích cực
"Mua được với giá tốt, sản phẩm đúng như mong đợi.",Tiêu cực
"Sản phẩm kém chất lượng, không đáng mua.",Tích cực
"Tôi rất thích sản phẩm này, chất lượng quá tốt so với giá tiền.",Tiêu cực
"Sản phẩm đến rất nhanh, gói hàng cẩn thận, mình rất hài lòng.",Tích cực
"Sản phẩm lỗi và không thể sử dụng, thất vọng.",Tiêu cực
"Chất lượng sản phẩm tốt, phù hợp với mức giá.",Tích cực
"Giao hàng trễ và dịch vụ không tốt, không hài lòng.",Tiêu cực
"Sản phẩm này làm mình rất hài lòng, đúng với mong đợi.",Tích cực
,Tiêu cực
"Giá cả hợp lý, chất lượng sản phẩm tốt, hài lòng.",Tích cực
"Sản phẩm quá kém, dùng chưa được 1 tuần đã hỏng.",Tiêu cực
Hàng đến sớm hơn dự kiến và sản phẩm rất tuyệt vời.,Tích cực
,Tiêu cực
